{
  "schema_version": 1,
  "title": "Daily Digest",
  "updated_at": "2026-10-18T08:49:20Z",
  "latest": {
    "schema_version": 1,
    "id": "urn:daily-digest:2026-10-18",
    "date": "2026-10-18",
    "title": "Daily Digest — October 18, 2026 · Technical Discovery",
    "summary": "Kagome flat bands, molecular attosecond delays, Floquet photonics, niobium carbide growth and ESP32 builds",
    "language": "en",
    "published_at": "2026-10-18T08:49:20Z",
    "filename": "daily-digest-2026-10-18.epub",
    "path": "editions/2026/10/18/daily-digest-2026-10-18.epub",
    "download_url": "https://raw.githubusercontent.com/michaelrolphone-cmyk/Daily-Digest-Epub/main/editions/2026/10/18/daily-digest-2026-10-18.epub",
    "media_type": "application/epub+zip",
    "size_bytes": 24856,
    "sha256": "327522a901680539a0ec5ab3a1f19bd6637c05b19dbb6c7e49da323c3552a760",
    "reporting_cutoff": "2026-10-18T08:49:19.273Z",
    "article_count": 7,
    "word_count": 3868,
    "estimated_reading_minutes": 19,
    "source_count": 12
  },
  "editions": [
    {
      "schema_version": 1,
      "id": "urn:daily-digest:2026-10-18",
      "date": "2026-10-18",
      "title": "Daily Digest — October 18, 2026 · Technical Discovery",
      "summary": "Kagome flat bands, molecular attosecond delays, Floquet photonics, niobium carbide growth and ESP32 builds",
      "language": "en",
      "published_at": "2026-10-18T08:49:20Z",
      "filename": "daily-digest-2026-10-18.epub",
      "path": "editions/2026/10/18/daily-digest-2026-10-18.epub",
      "download_url": "https://raw.githubusercontent.com/michaelrolphone-cmyk/Daily-Digest-Epub/main/editions/2026/10/18/daily-digest-2026-10-18.epub",
      "media_type": "application/epub+zip",
      "size_bytes": 24856,
      "sha256": "327522a901680539a0ec5ab3a1f19bd6637c05b19dbb6c7e49da323c3552a760",
      "reporting_cutoff": "2026-10-18T08:49:19.273Z",
      "article_count": 7,
      "word_count": 3868,
      "estimated_reading_minutes": 19,
      "source_count": 12
    },
    {
      "schema_version": 1,
      "id": "urn:daily-digest:2026-10-17",
      "date": "2026-10-17",
      "title": "Daily Digest — October 17, 2026 · Technical Discovery",
      "summary": "Light–sound coupling, parallel silicon qubits, molecular spins, mobile traps and ESP32 radio experiments",
      "language": "en",
      "published_at": "2026-10-17T07:55:00Z",
      "filename": "daily-digest-2026-10-17.epub",
      "path": "editions/2026/10/17/daily-digest-2026-10-17.epub",
      "download_url": "https://raw.githubusercontent.com/michaelrolphone-cmyk/Daily-Digest-Epub/main/editions/2026/10/17/daily-digest-2026-10-17.epub",
      "media_type": "application/epub+zip",
      "size_bytes": 23119,
      "sha256": "5a41339101d12c1458b242355354679b9faa136d94edc50b0e15591fcb4bce1f",
      "reporting_cutoff": "2026-10-17T01:50:00-06:00",
      "article_count": 6,
      "word_count": 3609,
      "estimated_reading_minutes": 18,
      "source_count": 13
    },
    {
      "schema_version": 1,
      "id": "urn:daily-digest:2026-10-15",
      "date": "2026-10-15",
      "title": "Daily Digest — October 15, 2026 · Technical Discovery",
      "summary": "Polar-metal order, 603 optical cavities, quantum timing, ESP32 post-quantum security and 30-fps e-paper",
      "language": "en",
      "published_at": "2026-10-15T08:21:06Z",
      "filename": "daily-digest-2026-10-15.epub",
      "path": "editions/2026/10/15/daily-digest-2026-10-15.epub",
      "download_url": "https://raw.githubusercontent.com/michaelrolphone-cmyk/Daily-Digest-Epub/main/editions/2026/10/15/daily-digest-2026-10-15.epub",
      "media_type": "application/epub+zip",
      "size_bytes": 26599,
      "sha256": "81601881bc69fa8c24d49a9f20104593a7a311f33fbd8a034bc67437b7afcb38",
      "reporting_cutoff": "2026-10-15T02:03:00-06:00",
      "article_count": 7,
      "word_count": 4040,
      "estimated_reading_minutes": 20,
      "source_count": 19
    },
    {
      "schema_version": 1,
      "id": "urn:daily-digest:2026-10-13",
      "date": "2026-10-13",
      "title": "Daily Digest — October 13, 2026 · Technical Discovery",
      "summary": "Active-matter topology, programmable quantum states, oscillator gates, photovoltaics and ESP32 engineering",
      "language": "en",
      "published_at": "2026-10-13T08:07:20Z",
      "filename": "daily-digest-2026-10-13.epub",
      "path": "editions/2026/10/13/daily-digest-2026-10-13.epub",
      "download_url": "https://raw.githubusercontent.com/michaelrolphone-cmyk/Daily-Digest-Epub/main/editions/2026/10/13/daily-digest-2026-10-13.epub",
      "media_type": "application/epub+zip",
      "size_bytes": 27656,
      "sha256": "9227365a2fda623416e5edaccf96bd6367b1b97d5b242554f765450d1fd5e34e",
      "reporting_cutoff": "2026-10-13T02:07:20-06:00",
      "article_count": 7,
      "word_count": 4551,
      "estimated_reading_minutes": 23,
      "source_count": 14
    },
    {
      "schema_version": 1,
      "id": "urn:daily-digest:2026-10-12",
      "date": "2026-10-12",
      "title": "Daily Digest — October 12, 2026 · Technical Discovery",
      "summary": "Picosecond superconductors, graphene phase probes, OLED chemistry and real-world ESP32 architecture",
      "language": "en",
      "published_at": "2026-10-12T09:08:17Z",
      "filename": "daily-digest-2026-10-12.epub",
      "path": "editions/2026/10/12/daily-digest-2026-10-12.epub",
      "download_url": "https://raw.githubusercontent.com/michaelrolphone-cmyk/Daily-Digest-Epub/main/editions/2026/10/12/daily-digest-2026-10-12.epub",
      "media_type": "application/epub+zip",
      "size_bytes": 30848,
      "sha256": "0b39a40cb33ecd304922e0b37928789df7c2ad4d6bd857697a2f1c47f9d7ce40",
      "reporting_cutoff": "2026-10-12T03:08:17-06:00",
      "article_count": 7,
      "word_count": 5441,
      "estimated_reading_minutes": 27,
      "source_count": 13
    },
    {
      "schema_version": 1,
      "id": "urn:daily-digest:2026-10-11",
      "date": "2026-10-11",
      "title": "Daily Digest — October 11, 2026 · Technical Edition",
      "summary": "Nuclear clocks, spin-driven mechanics, photonic logic, and the hidden engineering inside ESP32 projects",
      "language": "en",
      "published_at": "2026-10-11T15:57:58Z",
      "filename": "daily-digest-2026-10-11.epub",
      "path": "editions/2026/10/11/daily-digest-2026-10-11.epub",
      "download_url": "https://raw.githubusercontent.com/michaelrolphone-cmyk/Daily-Digest-Epub/main/editions/2026/10/11/daily-digest-2026-10-11.epub",
      "media_type": "application/epub+zip",
      "size_bytes": 29169,
      "sha256": "9394b236d29613ec3f45ba0b6d373877771978aeb69ac114b3a1b68f3924e3f6",
      "reporting_cutoff": "2026-10-11T09:57:58-06:00",
      "article_count": 6,
      "word_count": 4875,
      "estimated_reading_minutes": 24,
      "source_count": 29
    },
    {
      "schema_version": 1,
      "id": "urn:daily-digest:2026-10-10",
      "date": "2026-10-10",
      "title": "Daily Digest — October 10, 2026",
      "summary": "An unsettled world, useful technology, and a telescope made of ice",
      "language": "en",
      "published_at": "2026-10-11T03:36:31Z",
      "filename": "daily-digest-2026-10-10.epub",
      "path": "editions/2026/10/10/daily-digest-2026-10-10.epub",
      "download_url": "https://raw.githubusercontent.com/michaelrolphone-cmyk/Daily-Digest-Epub/main/editions/2026/10/10/daily-digest-2026-10-10.epub",
      "media_type": "application/epub+zip",
      "size_bytes": 30584,
      "sha256": "c1ef28325389fe7b7088ff890ab9a1427eb8cf0ec98ad7ff0fa5087632cdde23",
      "reporting_cutoff": "2026-10-10T21:25:05-06:00",
      "article_count": 15,
      "word_count": 3546,
      "estimated_reading_minutes": 18,
      "source_count": 24
    }
  ]
}
